Name,Review,Date
Josh,"Just ordered to my place in Peckham, first time using Pizza Hut…driver refused to drop and would not compromise was patronising and didn’t have any empathy for someone in a wheel chair literally just said”you come down or I leave” never ordering from this terrible company again|Useful|Share",17-Apr-22
Dávid Keczer,I really love the deep pan pizza the best 😏 cambridge orchard park.|Useful1|Share,15-Apr-22
Tes M,"Very bad, some times comes wrong item, another time they never deliver yet refuse to refund. Avoid|Useful|Share",12-Apr-22
SRKA,Pizza Hut they have been absolutely horrifying. They can never get your order right. Over an hour later we never received the right order no refund.I have received a pepperoni pizza and I order 2 vegetarian. I am not happy at all and the customer service is the same I highly do not recommend Pizza Hut.This has been the worst and I am not ordering from here again.|Useful|Share,10-Apr-22
Abd Alrahman Kalo,"Your branches in UAE - Ajman is the worst, i made a review and i called the customer service making a complain but they are careless.The is not the way how an international brand deal with the customersI would recommend Dominos Pizza over pizza hot|Useful|Share",Updated 10 Apr 2022
labli,"I visited Pizza Hut starcity Birmingham, enquired about why no tuna option on menu. The waiter said they stopped tuna for last 4 years. I tried to explain to him that we had tuna option before covid. Waiter became defensive and his customer service went down hill. He needed to prove his point, so speaks across to his colleague ignoring me.. all this over tuna.. ridiculous.. as I walked off he looks at his colleague with disbelief that I apparently imagined having eating tuna on my pizza … I got up and left as I won’t waste my precious £ in a restaurant with staff that have attitude towards customers…it’s my fault that’s his in a job that he doesn’t like.. maybe needs retraining|Useful|Share",9-Apr-22
PG Vosper,"Ordered 4 large pizzas for work last night to celebrate being in a new role and the food never arrived, tried calling the store no answer, tried this morning no answer and still been charged as they reckon the food arrived it never did!Such poor quality of service not even to respond to phone call trying to resolve|Useful|Share",Updated 9 Apr 2022
scottmiller,"Order desert that came 45 mins after the first one and because they clearly forgot and fx@k all but its on its way . S#,t hole|Useful|Share",6-Apr-22
Kai Rooney,Terrible I unsubscribed from there text messaging list and still received texts from them.After looking at my phone bill im being charged 13p every time i reply stop and pizza hut refuses to cover the cost with there only reply being im sorry. Clearly pizza hut dont care about customers and there privacy.I will now never buy from pizza hut again and have made sure the family wont either we have moved onto dominos or papajohns who do a better job anyway.If one of your lovely headoffice reps would like to solve this and refund the cost of unsubscribing from your texts which to clarify didnt work and i had to contact the customer service team to have my details removed then i will gladly accept a check or bank transfer|Useful|Share,3-Apr-22
Clair Maisey,AwfulDry.Ordered a pizza delivery after a few years away with Dominies ........wish we had stuck with Dominoes.Pizza was dry as f*&k . Cant say any more.Just awful.|Useful|Share,2-Apr-22
Nicola,Terrible evening at pizza hut St Helens.   Waited for at least 45 minutes for pizza to arrive - not even that busy.  Only after asking how long would the food be did it arrive.  Other diners came in after us and had their food brought after 15 minutes.   Nobody came to clear table either- other diners had tables cleared and pizzas boxed  up- not us .Complained to manager on leaving - not very sympathetic to our complaint- advised they prioritise deliveries over restaurant customers even though there is a dedicated take away delivery pizza hut in town. Very  poor customer service|Useful|Share,31-Mar-22
Consumer,"Terrible experience to say the least. I have been a Pizza Hut customer for more than 5 years but their pizza has been getting worse and so has their outrageous employees.Let’s keep this simple, this is what I found in my food.- 2-3 Spit Balls (HUMAN SPIT)- 1 Cockroach And my pizza was very burnt aswell. I’m definitely going to be contacting Pizza Hut to sort this out otherwise I’ll be filling a lawsuit for their negligence.|Useful|Share",30-Mar-22
Danny Mcgill,"Yet again Dominos have put their prices up and now charge delivery so tried Pizza Hut delivery. Pizzas are much better, better value for money and much better offers!|Useful|Share",28-Mar-22
Phi Phi's P.O.V,Abberville Road ClaphamPlaced and paid for an order and never received it.Called them to cancel and was told I can't cancel it or they can't deliver to the correct location because its far.Came home now and haven't even received said order. How can I spend £30+ on something and not receive anything.I have rang them 6+ times and no one is answering.Where is my order /money? This is ridiculous.I would like my refund for the order placed as it was not delivered and no one contacted at all to say anything.I have called 16 times with no one answering. Just every call cancelled.|Useful|Share,23-Mar-22
Kesha Williams,"Would give a 0 to the manager on at Greenford Pizza Hut 9th April 2022@ April 9pmThe manager has no customer service skills, is dishonest and needs further training on how to resolve matters without escalation!! He seemed to justify and argue rather than resolve???Missing food and not the right customer service you require for a mistake made on their side.  This is so frequent people are being robbed paying for things they don’t have ! Consistently....I even left a note on the website -please don’t forget? I will not order from Greenford branch AGAIN! Majorly put off by the lack of customer care from a reputable large company! No attention to detail and having been on the phone for 9 minutes shows ?! Go where you are respected as a paying customer and you will see the difference !|Useful|Share",14-Mar-22
Blackbutterflai,"Woodford Green: I haven't ordered from this place in ages ....gave them another chance today and they go and screw my order up yet again ... they think they can charge for a £6 brownie with alleged free ice cream dessert but the brownie portion size is an absolute joke!!!.... no ice cream delivered with my order... never again are they getting my money!!!  When you call, you get attitude or rushed off the call.  The delivery driver was Portuguese and didn't speak a word of English expecting to me to stand around with him fiddling on a translator on his phone!|Useful|Share",14-Mar-22
hannah,"My pizza was delivered very quickly - very rushed. The pizza was undercooked, the cheese was extremely sloppy and arrived displaced in a big mess. It was like a sea of cheese with no likeness to an actual pizza. Unfortunately for him - the man who answered the phone said he personally cooked the pizza and delivered it, he admitted this was his best effort and by his own admission ‘it could not have possibly been any better’. Honestly, what a shambles|Useful|Share",13-Mar-22
Mr Fabulous,"The positives about the Braehead Glasgow restaurant is the friendliness of the staff and nothing was a problem to them, they came across as a great team 👍🏽 But the restaurant was very dirty and thick with dust 👎🏽|Useful|Share",11-Mar-22
Morris W  Conway Jr,"Good afternoon to  everyone that work for the  Pizza Hut Stores Customer Center. I do hope that all of yous are doing ok smile. Also I do hope that all of yous will have a very Good day at work ok smile. In ending I want to tell all of yous that two of your very wonderful Staff members were so very Professional Helpful and very  very Caring when I called in to order a Pizza for myself and Mr Robert answered the Phone and ordered my request and very  nice Delivery Driver name  Mr Dajon delivered my request to my Appartment ok smile. Last of all I say that both Men have  very very Excellent Communication Skills and yes both knows and loves their job so very much ok smile. Now last of all before I end my Review I say that all of us say that both Employees work at location 7082  E Broadway Blvd, Tucson,AZ 85710.Praise the Lord and God is Good Amen and to all of yous from all of us please have a very  very Happy  Saturday day, night enjoy take care and may God always Bless and Watch over all of yous forever God Bless. Sincerely,Angela Hansen Anne Schleef Larissa Thacker Tevlyn Thacker Antonio Gonzales Anthony Dunson Larry Dunson Morris W Conway Jr|Useful|Share",6-Mar-22
Gary Studebaker,"Good Pizza, dishonest sales information. I was told over the phone the price of my pizza order would be $12.00. When I picked up my pizza, the price changed to $15.18. My receipt showed the following additional Pizza Hut charges. Pizza------------- $12.99 Not the price I was givenService fee:-------- 1.10  I was not informed that                                        Pizza Hut had a service feeSales tax------------1.09   (No problem)Balance due-------15.18Obviously I will not return to Pizza Hut.|Useful|Share",4-Mar-22
Suncho Pacheco,Muy mala la verdad la masa es muy dura seca sin sabor   la verdad es que medio curiosidad por probar pizza hut pero que desepcion la verdad dominos pizza es la mejor  pero no cambiaria a dominos pizza  y  a california pizza kitchen lo mejor  en pizzas no la  pizza hut no  volveria a comprar una pizza de pizza hut|Useful|Share,3-Mar-22
Unhappy Customer,Terrible Management in Derby. Kristin & Regional Manager are both rude. Will Never go there again. Pizza John's is the place to go.|Useful|Share,27-Feb-22
Jennie Williams,Useful|Share,26-Feb-22
Squidgey,"Went to the Manchester one and got gassed by some shabby geezer, couldn't finish my food and had to get checked over by an ambulance Night ruined|Useful|Share",26-Feb-22
Farid Abbasi,"It all started well, we were ushered to our table quite quickly. We scanned the QR code on our table and were able to place our order and pay for it, which was very convenient. However, things went downhill from there onwards: (1) We found the salad bar had a lot less choice than what we would normally expect. (2) Our starters came with the main course, actually one of them did not arrive till we were almost halfway through our main meal. (3) The worst was yet to come, we had to wait in access of 30 minutes for our desserts. I had to get up and reminded the waitresses three times. We were so fed up with waiting that we were about to leave when our desserts finally arrived. The whole experience was so bad that we will not go to the Bluewater Pizza Hut again. I regret that I added a 10% tip, the service was polite but well below par.|Useful|Share",26-Feb-22
Antony Parish,"Broadstairs delivery  Management have a poor attitude! We used to use Pizza Hut a fair amount but won’t use this one again!After receiving a poor order swimming in grease we phone and explained we were unhappy with what we received. We were offered the food to be re sent, or to have the order put into a book for us to order in the future free of charge.Phoned today to get our free order. The manager advised he was working that day but didn’t remember. He then went to check said ‘book’ to advise there was no note of our free order then went on to say  “we don’t give away free food. If you’re unhappy with the food we would have collected the order or re sent it”After a lot of back and fourth I was eventually offed part of the order but by this point I was sick of his attitude! Manager was rude and unhelpful.The bad food was not the problem as it happens sometimes.Management is the problem|Useful|Share",25-Feb-22
Barbara Crompton,"Great food, lovely staff, but after trying 4 times with differant receipts, it won't let you do the feedback thing, I'm never going to get anything|Useful|Share",25-Feb-22
clare,Went to Pizza Hut north harbour portsmouth.Food was ok. We pre booked our table for 7pm allowing enough time to get to our cinema booking at 830pm. We were seated quite quickly but not told about any delays on food orders or that I had to use the qr code to order. Order placed at 1923. Got our drinks approx 10 mins later but the salad bar was literally empty. Waited another 10 mins for it to be only 1/3 filled. At 2003 I asked the server how long it might be as we had cinema booked. She went to check and said about another 10-15 minutes. I asked her again at 2023. She said we were the next order to go in. I told her to just box the pizza up as we couldn’t eat on the restaurant and had to get to our movie. She apologised but was so rushed off her feet I don’t think it was overly sincere. I don’t believe so many people should be seated if it’s taking over an hour to cook a pizza. I spent £70 which isn’t a huge amount but I consider it a lot for a takeaway which is what we ended up with!|Useful|Share,25-Feb-22
Bhav,"Was carnage at the buffet, far too busy, and too messy not a great experience|Useful|Share",23-Feb-22
Julie,I had a bad experience with a Pizza Hut delivery on 1/14/22 from the Stoneybrook Taylorsville Rd location in Louisville Ky. I was not told to expect a delay when I placed the order. My order was not received until 1 1/2 hours later. I live less than 2 miles from the store. My pizza took a long drive around town and of course was cold and bland when received. I called the store during my wait and was offered credit. I have received emails saying the credit was processed. March 2nd and I'm still waiting on the credit. My emails are not being answered any longer.I can understand a shortage of delivery drivers and was ready to move on but I want my money back as promised. This has made a bad experience much worse.|Useful|Share,23-Feb-22
Alan Wright,"The decline of what use to be a great experience. I now realise why so many have closed. This review is about the Hayes restaurant. Regular users will know that the menu and ordering process is now done on line so takes a lot longer to give them your order having to navigate their menu and as a last resort ask one of the staff to help. There were plenty of staff on duty so why they can't just take your order like anywhere else, perhaps they think they are modern and forward thinking or just lazy? So we finally placed our mains order and be for you pay it asks if you would like to add any gratuity which is a joke as they haven't lifted a finger yet and the service as in this case might be crap.While waiting for our meal a couple of our party had the need to use the bathroom and as with most businesses that serve the public they had an inspection chart on the wall where staff inspect the bathroom at regular intervals to make sure they are hygienic and up to standard. So while we were in the bathroom one of the staff came in and went straight to the chart, logged the time and added their initials and went straight back out so there could have been any number of problems in there and they wouldn't have a clue. Anyway our food arrived and to be fair it was good as it usually is so why can't the service be the same.So back onto the experience and we had finished our main course and started to look online at the dessert menu and we placed our order after neatly stacking all our mains plates etc to help the staff and at the same time give them something to do.Our main course left overs, plates and utensils remained on the table all packed up ready to go with staff regularly passing by not daring to earn any gratuities. Our desserts arrived and were placed where there was space as much of the space was still taken by our main course stuff. So to quickly get to the end of this saga we ate our dessert with all of the mains rubbish still on the table and for this they charged us over £100 for the pleasure.Not sure I would bother again and certainly wouldn't use the Hayes restaurant.|Useful|Share",21-Feb-22
Stu,Put a order in on Pizza Hut website had a phone call saying it was to far to deliver even tho I put my postcode in and it said it can deliver Was told I need to call customer service to get a refund Customer service don’t answer I had to email my complaint and didn’t get answer back so can’t seem to get a refund and order never come|Useful|Share,20-Feb-22
Hannan Ali,Useful|Share,20-Feb-22
Clorinda Schroder,"Ordered food from Pizza Hut, Ardleigh Green. Delivered 2 pizzas instead of 3. Tried to explain to driver but he was already walking off and saying bye as food left at property. Called Pizza Hit who wouldn’t help. If you find my Pizza Tony can you bring it back, thanks|Useful|Share",19-Feb-22
Nash,"Appalling customer service. Went to pizzahut Greenwich, rude and I don't care attitude. My last visit to this store.|Useful|Share",18-Feb-22
MK,Ordered a pizza. Wasn’t delivered. Called them up. They said delivery guy hadn’t picked up and no idea when he would. Never again.|Useful|Share,18-Feb-22
Neighbbour,Went to the Plymouth Barbican ( Warner village site ) disappointing.No chicken and other missing items on menu.The dessert bar closed.Self service didn’t work on the app.Food ordered forgotten .Pizza ok and salad and not as bad as the royal parade branch  ( Plymouth ) was when we went once !|Useful|Share,18-Feb-22
Mark Woolk,very bad! I will not order again!|Useful|Share,10-Feb-22
Fikret,I would give 5 stars due to taste but gave 4 due to some of the food being slightly cold and could have been cooked a bit longer.|Useful|Share,10-Feb-22
Simpson Shelley,"ordered a pizza for delivery my order was taken so was my money as soon as i had paid i got message saying i needed to collect, i called within 1 min or the order explained i was disabled and could not collect to be told we do not deliver to your aerea even though 3 days earlier i had a pizza delivered, i requested a refund , it is now 9 days after the order date still waiting for my refund, lets see if pizza hut will let us order pizza and pay 9 days later I DONT THINK SOCustomer service appalling it is not about the money anymore its the principle , they take your money and run no customer care at all the only thing the staff say is put complaint in an email|Useful|Share",9-Feb-22
Bryony Kay,"The Pizza Hut by me ( mcarther glen )was awful! What an experience, firstly had to put napkins under the table to stop it wobbling, had a drink spillage and the woman gave me a roll of blue tissue to clean it myself! After cleaning the table I Took it upon myself to swap to a different one, the waiter rolled her eyes to have to wipe down the table we had just left. After eating our food I wanted a take away box, waited 20 minutes for someone to be out walking around, shouted and held my hand up. Nothing. Took myself to a staff area to find them all sitting down, chatting on their phones, Couldn’t wait to leave the place. Awful service|Useful|Share",Updated 15 May 2022
BethAnn Maestas,Ordered a med supreme came on time was cold cold had more sauce then toppings and sum toppings missing it tasted old like it was made earlier in the day I wasted 26.00 for a crappy order i will never order from em again|Useful|Share,6-Feb-22
Mechie Wilson,"The Pizza Hut here by my house is absolutely horrible no one answers the phone on time, they don't allow you time to place an order you feel like you're being rushed off of the phone, employees have zero enthusiasm about their job. The delivery driver is 30 minutes late. Me and my two children are hungry. Very unsatisfactory.|Useful|Share",6-Feb-22
customer,Ordered pizzas on just eat 19.30 went to pick up with hubby and kids for 20.15 at parkgate rotherham. Husband went in and left us in car at 20.40!pizzas still not ready! 3 staff thats it. They turned custom away and also stopped taking calls. Pizzas were £38 gor 3 pizzas n wedges . Not amazing for price. We will not be rushing back . Felt for staff under so much stress just for pizzas. I work for nhs and this was a joke. Kids were not that hungry when we got home at 8.55!!!!|Useful|Share,6-Feb-22
Helen Naing,"Very Unprofessional, Very Very Rude, No Respect to customers. AVOID AT ALL COST! Today I ordered a pizza, 2 sides and a drink for delivery from Hackney Pizza Hut, London. The order was accepted and I waited for about 2 hours. I also add a note to request to ring my phone on arrival. After about 2 hours, in order page, it showed 'Your food has arrived'. But I didn't receive any call for the delivery. But when I saw that message 'Your food has arrived on the laptop where I made the order, I went outside to check but nobody was there. I called the Hackney shop, the man was very impatient to answer the call and said to me that the delivery man will call me on arrival and asked me to wait. I waited for another 10 minutes, nobody called. But, I received the email asking for feedback. Then I called the shop again but the man doesn’t seem happy to answer my call. I said I didn’t receive any call but he replied as ‘WE CAN’T CALL EVERY CUSTOMER’. I asked how I will know when the delivery came if I don’t receive any call. He said another 30 minutes and cut the call. I waited for another 1 hour. Nobody came and nobody called. I tried to call the shop about 4 times but nobody received the call. He must have known I called and so he didn’t receive my calls. He didn’t try to solve the issue at all but instead just replying ‘WE CAN’T CALL EVERY CUSTOMERS’ is very unacceptable. My baby cried very badly and we waited for more than 3 hours for the food which was never coming. Very Unprofessional, Very Very Rude, No Respect to customers. AVOID AT ALL COST!|Useful|Share",2-Feb-22
Philip Leatherland,A deep pan pizza. Large   £18.49. Bad enough. Now a £1 delivery???? So near £20 for a pizza??? Get a grip.   Shame on you!!!!!!|Useful|Share,1-Feb-22
Teri Lockwood,"I stopped in at the Pizza Hut in Brownfield, TX to order a salad and wings. The menu showed a Caesar salad and a variety of wings. I ordered the chicken Caesar salad and 8 boneless wings. After 30 MINUTES I received my Caesar salad with no Caesar dressing and almost warm chicken wings. I asked for Caesar dressing and all I was told is “we just have Ranch.” All this with attitude. Five people standing around doing NOTHING!!!! So that tells me someone could have gone to the grocery store and bought some damn Caesar salad dressing. I guess what really got the attitude going was when I asked for another Ranch dressing because somehow one tiny cup was enough for the salad and the wings. Service was horrible. The employees were horrible. The wait time was horrible. For all this I most certainly would fire the manager. That is where the excellent service starts. This Pizza Hut gets no star review. I will never eat there again and I will not recommend this particular Pizza Hut to anyone.|Useful|Share",31-Jan-22
Paula Unsworth,"I don’t know what’s happened to Pizza Hut the quality of the food is shocking your not getting the real deal. The chicken is reformed , the potato wedges are semi cooked and warm and the pizza isn’t pleasant . This is home delivery service really puts you off going into their restaurants to make a night of it ..|Useful|Share",30-Jan-22
Bevy,"Pizza- Hut Bradford Exchange. Placed an online order which was accepted at 17:28 for collection at 19:15.  Arrived waited almost 10mins for someone to acknowledge me only to be advised order received but not sent through to the kitchen, did I want a free dessert.  I declined as would have ordered a dessert if I wanted one.  Was told would be max 7 mins & assured food would be cooked properly & hot. Came 10-12 mins later. Pizza had bits of olives on it, I didn’t order and I don’t eat olives.Sweet corn was stone cold and not edible. Not a very good National Eat Pizza Day for me!|Useful|Share",28-Jan-22
CM,"Ordered pizzas and other items that never came. During the order I asked for a ""no contact"" delivery. The driver decided to try to call me on my phone which requires that the caller say their name and what they are calling about BEFORE ringing my phone. The driver did not bother, hung up, and went back to the store. Nobody tried after that to deliver the $75+ order or let me know that they were not going to deliver it. Then, when I called to ask why it wasn't there after more than 2 hours they would not let me talk to their manager. I later drove to the store location and found the manager's information posted in that location was from a manager that hadn't overseen that location for more than 2 years he said when I called him. The actual manager did not post his information. Total garbage for a company. Not the first time they have done things like this, but this was the last time we'll order from them.Update: This was at the North Liberty, IA location and this isn't the first time they've failed to complete an order. It will be the last time we try getting food from there though.|Useful|Share",26-Jan-22
Kevin,Had to wait a while for delivery.When pizzas came it was very dry and warm. Obviously left food in oven to long.Also found an hair in one of the pizzas.Disgusting.Will not order from them again|Useful|Share,25-Jan-22
Cindi,"I have to say the pizza I received from Aloca Hwy. TN Pizza Hut was the best pizza I've had in a very long time. The crust was crispy, I ordered a pepperoni lovers, it had lots of pepperoni on it. It was Hot and I loved it! Thank you for improving.|Useful|Share",22-Jan-22
