Name,Review,Date
Clifford Smith,For the second time items missing from orders … called 3 times and was hung up on … head office directs you to a website no customer service at all will never order again|Useful2|Share,7-Jul-21
Gary Medley,"Tonight is the third time I ordered a medium pepperoni pizza from this store with EXTRA SAUCE. It is the THIRD TIME I got NO SAUCE. The store is located on Mexico Rd in St. Peter’s, MO. I will NEVER go there again…INEXCUSABLE!|Useful|Share",6-Jul-21
Madison C.,Every time I order the bakery style breadsticks they always screw me out of one. It would be fine if it wasn't every single time I order it now.|Useful|Share,6-Jul-21
wolfie artest,"Waitress took our order and left. After 15 minutes I walked to drink station and started making my own drinks. She told me I couldn’t do that and sent someone else to bring drinks. Pizza finally came, terrible. While we were eating, waitress rolls a large garbage can right next to our table to clean the next table. She asked if we needed a drink and my husband said yes. She started and finished cleaning the other table. Walked from that table to ours without washing her hands (no gloves) and picked up his cup and refilled it. She went back to the garbage can and kicked it toward another table. She left the garbage can and went to the kitchen and came back with her cell phone which was on speaker phone and talked to someone while scraping food into the can. This service is so unacceptable! Pizza was terrible! A frozen pizza would have been better. Probably the worst experience I’ve ever had at Pizza Hut.|Useful2|Share",6-Jul-21
Mark Brown,"Pizza Hut has gone to the dark side of patriotism. Their pizza sucks, as well as their thinking. Don’t buy this product anymore. We used to give all pizza stores a shot. Pizza Hut  has shot them selves in the foot. SEE YA!|Useful1|Share",28-Jun-21
Anahys Lozano,I used to like Pizza Hut but their prices have inflated and quality has gone down. I ordered 2 large plain pizzas for $30 and 12 wings for $15 AND I had to pay for the dipping sauce separately. I will stick with my local pizza restaurants moving forward.|Useful|Share,25-Jun-21
Charles Hodgin,"Not only did we pay twice as much for a large 3 ingredient pizza, the pizza was among the worse we have ever eaten.3 strips of Canadian bacon, hardly any mushrooms, and a smattering of olives on this cardboard imitation of a crust.Throwing 20 dollars out the window would have been more satisfying than eating this joke.And no more parmesan cheese unless you pony up 99 cents more.Tombstone is better than this.Never will we be back.|Useful1|Share",23-Jun-21
Jeff Daniel,35 dollars including at tip of 5 dollars for a medium pizza I will eventually stop buying pizza period and making my own .Unbelievable|Useful|Share,23-Jun-21
Melissa Coker,"Josh the mgr at pizza hut on Eastchase Pkwy in Fort worth, tx has excellent customer service, I have my grandbabies for the summer so I decided to purchase a meat lovers pizza, so I told them and they decided they wanted pepperoni lovers instead,  Josh made that for them at No Charge. He was very patient and understanding. Thank you Josh😊😊|Useful|Share",22-Jun-21
Theresa M Fairbanks,"Honestly if there were no stars it would be better!  Terrible Pizza, nasty stuff!  America First 🇺🇸 All lives Matter!|Useful|Share",20-Jun-21
Josie Buccellato Masturzo,I had a ver ugly conversation with Page a worker who said she was a manager at Pizza Hut on Shears Rd Mooresville NC. She was very rude condescending and arrogant.  I had to come into the store a video an issue that they owed me a bad batch of wings ordered once before.|Useful|Share,20-Jun-21
Kristen Chewning,This location can’t seem to get it together. They are always 1.5-2 hours long for a deliver. I placed an order online- delivery got pushed to another hour longer so I called to ask if I can pick it up- lady that answers the phone RUDELY says “Pizza Hut- WERE CLOSED” when I informed her I placed and order online and already paid for it she said it’ll be 1.5 hours. (This is after eating an hour and half already) so I asked if I can pick it up and luckily before she hung up I got to ask when I can get it....another 30 minutes.|Useful|Share,19-Jun-21
Phil D'Arcy,I collected my pizza from Chloe Parker. Very friendly and cooked perfectly. This is the first time I have bought a pizza from here but it won’t be the last|Useful|Share,17-Jun-21
Kirsty Darcy,"Pizza Hut Shinfield road ReadingBrilliant service by Chloe Parker. It was made to perfection, Hot and tasty. Thank you xx|Useful|Share",17-Jun-21
Michael Lotito,"This location was horrible: 6111 Crawfordsville Rd.Speedway, IN 46224(317) 381-0507Order was cold, only 6 discussing wings on order of 8 and when I called now answer, kept getting hung up on.|Useful|Share",Updated 17 Jun 2021
Paula Shoulars,The pizza was dry got the wrong wings want bone in wing didn’t ask for bbq bone less wings|Useful|Share,16-Jun-21
Andrea,"Great Job Today!!! Pizza was awesome!!! Local Pizza Hut in Macclenny, FL|Useful|Share",16-Jun-21
Steven Ladrido,"I ordered from the local Pizza Hut on Potranco in San Antonio Texas. This was the worst food I have ever eaten from Pizza Hut. First off the driver passed our house for delivery and returned approximately 15 minutes later, so the food was not hot not even warm.  Second off the Matzarella sticks were deep fried so long the cheese was almost gone. The bread sticks we ordered but. Also the Matzarella sticks had fried chicken parts stuck to them. This was Pizza Hut delivery and product I have ever tasted. Calling the store was a waste of time all we were told was sorry!!!!!|Useful|Share",14-Jun-21
HC,"We ordered a bunch of pizzas for carry out. When we went in to pick up our order, I asked the female employee if they had any plates. She looked completely stoned and said “What’s a plate?”|Useful|Share",14-Jun-21
David Jones,"Went to a Pizza Hut in the UK for the first time in years. Nice restaurant and pleasant staff, but the place was nearly empty on a Saturday night. I wonder why? We were then informed we have to order online and we can't get our own salad bowl. What? I come to a restaurant to be waited on, not be the waiter for 3 other people. Spent a confusing an annoying 20 minutes navigating their website on the phone and ordering and paying for everyone else's food and drinks, really annoying. God help anyone without a smart phone or internet access, they would have to leave. As we leave, there is literally no one in the restaurant at 8:00pm on a Saturday night! No atmosphere whatsoever! As long as they have this stupid policy, I won't ever be back.|Useful|Share",11-Jun-21
julie larter,"Absolutely terrible!!! They are making an absolute fortune out of this sham of a buffet, at the end of the day, if you can’t offer what you used to due to COVID then do something different, the bluffet is in no way similar to the buffet of old, what an absolute waste of money!!! Feel so ripped off, also, despite barely any customers in the restaurant the service was painfully slow! - Pizza Hut Kings Lynn Norfolk, UK|Useful|Share",11-Jun-21
Martha Bentley,"I ordered a flatbread and side salad, and a bottomless drink. Arrived with 2 others in my party. Orders were made but by the time mine came after a delay , the other two had finished. When my order came I was missing my salad and was left without cutlery. After attracting the attention of a waiter a knife was finally given but couldn't cut the pizza. The side salad still never arrived. During the meal we were never asked if it was satisfactory or were given the opportunity to refill our drinks. One of the party had to get up and find a waiter to get a box and ask for a refill.  We got a box but still no refill so we gave up and left.|Useful|Share",10-Jun-21
susan carr,I have been to Pizza Hut many times and food and service has always been brilliant until this time. Was stuck in a corner and from then on I felt and was in every way invisible. Only half the order received and forget your refills of drinks as I never got any. No one came near the table. Customer service was great for the people at the front tables near the kitchen as they were attended on  hand and foot. Left after half an hour as I couldn’t get anyone’s attention. I was out for a family tea for my birthday. Thank you very much for making it special. I will never go back|Useful|Share,Updated 7 Jun 2021
Jamie Hutton,"We had booked to come here and we were placed at the back of the restaurant and forgotten about. We ordered on the app which was fine the drinks came and mine was wrong.I ordered a kopperberg mixed fruits and was given strawberry and lime, I thought this was a mistake. I tried to get the attention of the host, however as we were at the back no one could see us. Our meal came and I had said my drink was wrong (15 mins after receiving this) to which I was told that's what I ordered, I confirmed it shows on my order on the App it was a mixed fruit. The girl then said she needed to go get the tray to take my drink back, after 5 minutes she returned and advised there was no mixed fruits? (therefore it wasn't a mistake and it was on purpose they gave me the wrong one.) With no alternative I had to keep this.We then asked for sauce which we received, however this was a small amount and no salt on the table, no one came back to check on us and make sure our food was okay. As we were at the back we couldn't get anyone attention for sauce or salt. We then finished out food and left, the table wasn't cleaned, we weren't offered more drinks, no deserts. I understand this is COVID etc, however the host should still be making sure all our meals were okay. There was 4 of us at the table and we all spent £67 in total. I'm happy to send you their order number too as we all ordered separately.Really disappointing experience.|Useful|Share",6-Jun-21
Layne London,"Terrible service.   I ordered online. They didn’t make the pizza I wanted anymore (taco pizza). Which wasn’t a big deal. It was the way they handled things after that. The ast manager Stewart was very rude and hard to work with. Told me he had no way to compensate my order if I came to pick it up. Because at this point it was going to be a good 40 minutes later.  And I had already paid  at least $10 in delivery fees and such.  This is the shortened version of the story, so not to complicate things.   I ended up canceling my order.  He lost my order.|Useful|Share",5-Jun-21
A,Hot and fresh fast delivery highly satisfied with Delia she was so polite and delivered our order with care. Thank you DELIA! definitely order again <3|Useful|Share,4-Jun-21
Fraz Ahmed,Bad Taste Expensive than any other pizza pointsworst dealing with customers in the branch of my area|Useful|Share,3-Jun-21
Mikki,"Hi Pizza Hut,     I Swear I am not one to complain. In fact I’m one of Those rare people who call or go online to let them know that I know when they do it so right and or kind. I and my family have been customers of Pizza Hut for decades!!!!  And To Be Honest, to My Surprise the delivery service that We have gotten the last few times has bee….a bit upsetting. But We never ever complain. But After how bad the last time was, that We never said a word about, yet honestly should have….When We relieved such a repeatedly bad delivery again, that this time I called. And to This Ild Mama/Nana’s Horror…This is The Unimaginable Response that We got and Left My Sweet Little Grandkids in Tears. I called The location that We ordered Our Pizza from. I nicely asked, Why did They not knock or ring the bell when they left the pizza on our cold rainy porch? Instantly the person said “hey wait while I get The manager”. It was soon clear that they thought they had put me on hold. Because the female manager said “keep them on hold awhile, what do they expect, it’s not our job to ring the doorbell.” After awhile a girl, who was instantly hostile, asked what my problem was? I explained that I was told to expect the pizza by 6:40. Yet the app said that it was out for delivery at 6:20. So My Grandkids & I sat at the dining room table laughing and waiting. But no knock no doorbell. So at 6:40 I went to the door and found the pizza in the cold rain. I asked Her why didn’t they knock or ring the bell since I couldn’t know when in those 20 minutes it would arrive. She yelled at Me, on speakerphone where My little grandkids heard, “don’t You use profanity at Me!!!” All I asked was why did they not ring my bell when they left the pizza on my front porch? No profanity thank You!!!! In front of My We ones Especially!!!!! She hung up on Me!!!! I tried to call back to clear things up!!! But they hung up on Me without even answering for 24 times😱. Who does that???? What professional business does that???? I just wanted an answer 😢. I swear that is all!!!! I’m 59 years old. I’m a good woman who always treats others with kindness and respect. My Precious Grandkids Wouldn’t even eat the pizza if I heated it up. They were so shocked to hear Their Nana treated in this way!!! I do not want a free pizza.. I want, deserve for this woman to be properly disciplined and I deserve a proper apology. That is all I want. She must not be allowed to represent Your business in this way. To be so rude, disrespectful and unprofessional from the very first moment and to accuse Me of saying something I never ever say!!!! Instead of facing the problem, is beyond not ok. How unprofessional!!!!! To no longer even except the call!!!! I didn’t treat Her or the business badly. There is absolutely no excuse for the delivery service or most of all Her treatment of Me!!!!! Please I’m asking You to not let this woman represent Your Company in this horrific way. It would make all the difference in the world to me and my large family to hear back from You with real results!!!! It’s just a pizza….yet We are deeply hurt 😔. That’s just the very honest sad truth.|Useful1|Share",2-Jun-21
Zack Hall,I ordered wings from the Pizza Hut in headland and they came out burnt and then I got home and found a hair in my food and when I called back up there they hung up in my face and then I called back again and they said they couldn’t refund my food. DO NOT eat at the Pizza Hut in headland|Useful1|Share,2-Jun-21
MAWade lost customer,"Never, ever call you order in by phone. I called my last order in and the call  was sent to a call center somewhere. I could barely understand the person on the other end. I should have hung up then. I arrived at the Jefferson St. Newnan Ga location and my total was $62 dollars, I know i should have refused the order, since the price on the sign was $25 for the same items I ordered. I was informed the reason was that I had ordered by phone . Crust had no seasoning either. RipOff, I will not be back. Be Warned|Useful1|Share",1-Jun-21
Monique Green,"With all that has been going on we had cut back on eating out. We decided to treat the kids to pizza and unfortunately we shouldn't have. The pizza and breadsticks wasn't edible. The wings had no sauce on them. We called and they acted as if we were just bothering them. In the end they only offered a credit for one pizza. In a time were other's are forced closed,  you think you would be trying your hardest to put your best quality product out! truly disappointed!!|Useful|Share",31-May-21
Louise,Helen fromPizza Hut silverlink absolutely lovely and gave out amazing service ... very friendly helpful to us while we were struggling to order in the app ! She deserves a bonus!!|Useful|Share,30-May-21
janice,"Me and a couple of friends decided to have  a meal in PH. loacted Lakeside Shopping Centre The first thing the staff member ask us have we an NHS app we didn't so she had to individually took out details down.  once we did this she then advised us she will show us to our table, but we have to  order and pay online and she will even show us how to  how to order.  If I wanted to  order online I would've done that at home as a take away. (but now will not use PH) they now are not accepting contactless payment or cash.  we decided to  go somewhere else that did accept cash or card payment. before we left we asked her to  delete our details off their system she then informed us she has already submitted through.  if she advised in the first place about this online order we would have left their premises prior to  give out our contact details since we weren't going to  stay there.  I totally disagree  of this sly way of having our details submitted and ordering online while in their restaurant|Useful|Share",30-May-21
Patricia Harris,Ordered a pizza for delivery.  40 minutes later we get a call that they have no delivery drivers! We called 6 times to get a refund; even after speaking with customer service 3 times and was told the District Manager would call - never heard from anyone.  You would think someone would reach out to us to not only refund our money but to make things right.  I got my refund by going to my bank. Perhaps they are so big they really don’t care about customer service; terrible.|Useful|Share,27-May-21
Leon,Worst experience ever . Ordered my pizza online and paid for online . Gets a phone call from the pizza place telling me the oven has gone off and that they can’t fulfil my order . I said can you pass it on to some other Pizza Hut store . They said no . So I asked what about my money she said oh we can’t give it you back you will have to ring customer services and request it back . I was utterly gobsmacked . That was last Sunday night so I couldn’t ring customer services then and then next day was bank holiday Monday so neither could a ring them them . So there I was with no pizza and out of pocket £20 . I got intouch with customer service on the Tuesday and to and throwing they had to ask the store to confirm it before they could refund me . Like why ? They said they would refund it me back anyway I’m still waiting for it . What a discrase shame on Pizza Hut didn’t even offer a apology not even some kind of gratitude for the absolute discusting customer service they give out and the way they run things . I will never use Pizza Hut again|Useful|Share,27-May-21
Ryan Lehmann,"Ordered a pizza with contact less delivery.  The driver ignored this request and rang the doorbell.  When we got our pizza, there was a note saying...""enjoy your pizza dipshit."" The manager, Emily, couldn't have cared less and didn't even offer us our money back. We threw the pizza out for fear it had been tampered with.|Useful|Share",22-May-21
Walter Taylor,"Why don't we customers complain about the supposed ""delivery fee"" that we're charged for food delivery? Little, if any of the delivery fee goes to the delivery drivers, which leaves me to wonder if it's an unwarranted usury tax!  Food delivery drivers bust their behinds to get our food to us on time, so I ask you, why are the corporations cashing in on their hard labor?It's about time people start complaining about the delivery fees being surreptitiously charged to them! Delivery fees belong to the delivery drivers, not the corporations!|Useful|Share",Updated 22 May 2021
Dan Roberts,"Keep sending flyers through my door no matter how many signs i put up. So im no longer going to buy pizzas from pizza hut. There are soooo many better pizza places  out there anyway, no big loss.|Useful1|Share",22-May-21
Cali,"I actually like their pizza. They put a generous amount of cheese and sauce. I specially enjoy their boneless bites - medium buffalo. However, their website's interface needs to improve to make it easier to order from it.|Useful|Share",22-May-21
Pedram MInazad,The pizza was made so cheap. It was low on essential ingredients (cheese and pepperoni). High on red sauce and vegetables.  Last time um eating pizza hut.|Useful|Share,21-May-21
Mr Umesh Sharma,"Stay away from local FranchisesPlaced an order with the local franchise of Pizza Hut around 7.30 PM for 9.00 PM delivery on 30/05/21. The Franchisee address is Pizza Hut Chesterfield Hut, 165 Chatsworth Road, Chesterfield, Derbyshire, S40 2AU, 01246 555503Till 9.30PM order was not even prepared and when I called the local branch, was informed that order is leaving. Infact it didn’t leave till 10 PM and I have taken picture images from their “Track my order”.At 10.15 PM received a call from delivery boy that he is new and hence somewhere near way. Exasperated I asked him to wait there so that I can collect it. Received totally cold pizzas which seem to be under cooked or defrosted one. Finally threw them in bin only. It’s a shame that no one owns the responsibility about punctuality, bad food. Pizza Huts customer services is non existent. Stay away from these totally unprofessional franchises which even Pizza Hut refuses to own when things go wrong . It’s better to order from small local stores who appreciate your business.|Useful|Share",17-May-21
Faysal,"Wow, where do i start, terrible service at Finchley restaurant and a nightmare to order as it has to be done online although we’re sitting inside pizza hut. Basically you have to fill in an application form everytime you want to order.|Useful|Share",15-May-21
Wayne,"I don't mind paying for what I want, but want what I pay for. A total of 3 slices of pepperoni on a large pizza is ridiculous. Little Ceasers here I come.|Useful|Share",11-May-21
Destiny Smith,"EXPERIENCE… TERRIBLE! Food Was Cool , Boneless Wigs Were Mushy ! & It Took More Than An Hour To Get Here ! 9740 St. Charles Rock Road  BRECKENRIDGE ‼️‼️ DO NOT BUY FROM THERE .|Useful|Share",7-May-21
Damien L. Kage,"Pizza hut are the best pizza, the staff are friendly and the food is amazing.|Useful|Share",6-May-21
Sandy Jasionowski,"I made my order online, paid for it and marked to pickup. When I went to the drive up window (as instructed by the ap), the car in front of me was there for 9 minutes. When I finally got to the window they couldn't find my order. I showed them my order on my phone, and they then found it in the warmer. I asked them why they didn't instruct the car in front of me to pull up and wait elsewhere like they do to me ? They didn't know why. My pizza &  fries were soggy, and the two salads were warm as they were packed with the warm food and kept in the warmer.  Terrible service and food.|Useful|Share",6-May-21
Belinda McGuire,"Pizza hut has been a part of my life from my 12th birthday  and are still going on. And this year was the best. And the service was excellent very helpful. And the employee who helped me. I want to give two him thumbs up. He was just the best. So if your hungry come to the Franklin, North Carolina. Pizza Hut .They have the  best service. I promise you won't regret it.|Useful|Share",Updated 5 May 2021
Mike Rybakowski,"First time to Grimsby Pizza Hut, excellent service, food, price but best of all the staff were so efficient, helpful and friendly. Well done Pizza hut 👍👍👍|Useful|Share",5-May-21
Victoria Owens,"I would have given it 1 star if it wasnt for the lovely lad on the phone and the second driver: My mum and I had ordered pizza hut delivery (UK). With contactless delivery, we were made to pay online initially before we could get our food (which was perfectly fine with us). The tracker was then emailed to state that the delivery would be made at 21:10-21:20 which we thought ""40 minute wait is fine by us"". So we waited...and waited...and continued to wait until 21:28. Now it got to the point where, whilst overall being late doesnt necessarily bother us (our area is a maze) we can see ALL cars entering where our house is and NONE had turned up...I then proceeded to receive a text stating the food had been delivered. this is not the case. I phoned up our local store (where the food was coming from) and spoke to a lovely lad who was kind, who offered to call the driver, who then proceed to lie to this lad and say he ""had delivered the food to [my address]""....""no sir, he didnt, our house has views from the sitting-room to the entrances of the street and NO cars have been here at all."" The poor lad then says ""Right ok...give me a moment""...my mum at this point had stood at the door for about 40 minutes wondering when this pizza delivery would arrive and said ""We can do a video and prove we have no boxes if he would like"".....the lad came back and said he would arrange for the order to be sent out ASAP. The second driver arrived within 30 minutes of us phoning and he was lovely even shutting our front door for us.Overall, if we could have paid in cash, this situation wouldn't have bothered us as much as it had. However, I would like to suggest that in future, for continued use of contactless delivery - the drivers should ask the home owner for the order number before handing over the goods. This way, when customers pay online you will not come across a he-said-she-said situation. Just a thought.|Useful|Share",4-May-21
BITCH,TO MANY BLACK LOW LIFES ADVERTISING THIS CRAP  HAS BEINGS|Useful|Share,3-May-21
