Name,Review,Date
gabriel mereuta,"Ordered at 18:16 for a 19:15 delivery on the 14th of March but they arrived at 19:50 with cold pizza.Could not get to any arrangement with Rayners Lane Hut and got in touch with customer service asking for a refund.The reply was that they will give me a £10 voucher for my next order but it has to be used on a full price menu(if you use the saving bot it’s a lot cheaper).Totally unacceptable.Got 2 cold pizza’s and a £10 voucher that are useless.Thank you very much Pizza Hut,i will NOT see you next time.|Useful|Share",5-Mar-23
Simone B Crow,Useful|Share,4-Mar-23
Jon Wray,Useful|Share,3-Mar-23
Lilly Shannon,Food was nice and nice and hot. Plenty of cheese just like I asked. My mouth is watering whilst writing this. Yumm|Useful|Share,1-Mar-23
Lisa Von Trappengard,"Oh honey, let me tell you about my recent experience at Pizza Hut as an 80-year-old grandma. I walked in and was pleasantly surprised by the cleanliness of the restaurant. You know, some places just can't seem to get the memo that customers don't want to eat in filth.But enough about that, let's talk about the pizza. I ordered the pepperoni and let me tell you, it was everything I could have hoped for and more. The crust was crispy and had just the right amount of chewiness, the sauce was flavorful without being overpowering, and the toppings were plentiful.But what really stood out to me was the customer service. The staff was attentive and went out of their way to make sure I had a great experience. They even helped me carry my pizza out to the car. Now that's what I call service!Overall, I would highly recommend Pizza Hut to anyone looking for a great meal and outstanding customer service. Don't waste your time at those other pizza joints that can't seem to get it right. Pizza Hut is where it's at, honey!|Useful|Share",1-Mar-23
Ali,After making  2 official complain to Pizza Hut customer services this the 3rd time I order and receiving half dried pizza no topping no cheese with big inflated bubble. all 3 order came from Mill Hill broadway brunch|Useful|Share,28-Feb-23
Frances,I ordered a pizza on Friday night (10th March) when it arrived it had what I think were bits of burnt cheese on the end of it which were absolutely black! The pizza itself was like a cracker rectangular in shape parts of the crust were so hard I couldn't eat it. The whole pizza looked like an after thought! The white plastic thing stuck in the middle of it not even cut with a pizza cutter. I will never order from pizza hut again. They are an absolute disgrace.!!!!|Useful|Share,25-Feb-23
customer,All food was freezing cold and items were missing. Very rude on the phone|Useful|Share,25-Feb-23
Jan Gregořica,"I visited Manchester yesterday with my daughter and after shopping in Primark we wanted to go something to eat. So the nearest and just opposite the road was Pizza Hut, we wanted to use the toilets first and then order our meals. But a very rude man approached us and without any asking or even greeting “Hello, what can I do for you? Would you like to eat in our restaurant etc..”, just said that toilets are closed and for customers! So how did he know we are not customers? We weren’t allowed to use toilets and even put our orders! Obviously this business has enough customers and cannot appreciate customers! It was very rude and not professional, horrible customer service! Very embarrassing for us! I will never use their services!!|Useful3|Share",23-Feb-23
customer,"We ordered a double pepperoni big new yorker and paid for extra cheese got like 12 pepperoni and so little l e cheese the crust bubbled through with not enough cheese to fill cover the tomato sauce.Complete BS and now they won't answer the phone. This was the worst pizza hut pizza I ever ate, from star idaho to 210 ascent court.|Useful2|Share",23-Feb-23
Leslie Garrett,I wish I could give no stars. WORST COMPANY IN the  HISTORY OF PIZZA COMPANIES !!! I will NEVER order from Pizza Hut ever again. Customer service is a JOKE!!! y’all need to figure out a new way cause this is BS!!!|Useful1|Share,20-Feb-23
Sarah,"I was excited to see that Pizza Hut near me had started offering gluten free, vegan pizzas. I am not vegan, but cannot have lactose so often have to opt for vegan cheese. I was unable to add meat alongside vegan cheese, which was inconvenient but I decided I'd be happy with a veggie pizza. The photos on the website showed a round pizza, looking pretty delicious as you'd expect. When I got the pizza it was a very sad attempt at pizza... I'd say it was more a dry cracker and it was a rectangle shape. There was hardly any cheese on so the base had gone like cardboard. For over £18 it was just an absolute joke (especially considering the non GF one was 8.99 for a large). I will stick to making my own pizzas at home with schar bases (which are lovely and far from dry).|Useful1|Share",19-Feb-23
Willie McCoy,Ordered online and never received the product…spoke with ten different people about my order but got a different response from each of the call center people that don’t even work in the store.  By the way they debited my account for the food that I didn’t get.|Useful|Share,19-Feb-23
Phil,Some years ago Pizza Hut came out with the big New Yorker and that was the only Pizza I liked from there. I find their pizza too greasy not enough toppings or sauce just not my style. I did enjoy the big New Yorker so when the announcement came out that it was returning I was happy to try it again. I ordered one tonight the worst pizza I've had in years. Nothing like the original big New Yorker looked nothing like it tasted nothing like it. I do not know what they sprinkled on it but it literally was like biting into a salt packet with cheese and sauce on it. I came home and I've got some stray cats and dogs in my area I literally sat the pizza out for them. I am truly disappointed because that was the one pizza years ago that they did right. I think they let a lot of people down that don't really do Pizza Hut often and we're excited about the return of the big new yorker. Hopefully someone higher up sees this and maybe they can correct the issue.|Useful|Share,19-Feb-23
Julian Webster,"Chesterfield Brampton branch is diabolical! Ignorant, arrogant staff! Walked in and greeted by a ‘yer and’ I only wanted to place an order but walked out due to the discussing service.|Useful|Share",17-Feb-23
Paul Powers,"I recently ordered from Pizza Hut with my family in restaurant and overall I had a good experience. The pizza was hot, fresh, and tasted delicious. The crust was crispy and the toppings were generous. However, the delivery time was a bit longer than expected, which was a bit frustrating. Additionally, while the menu options are good, I wish they had more vegetarian and vegan options. The staff was friendly and the ordering process was easy, and the restaurant was clean and well-maintained. Overall, I enjoyed my experience with Pizza Hut and would definitely order from them again.|Useful|Share",16-Feb-23
Margaret N.,"I tried to use the on-line order form BUT was unable to. Tried a number of times. Not only wasn't I able to use the on-line order form; I also could not redeem my accumulated points. So, I had to pay full price for the order. I asked the person @ store re: use of points & she said she could not help w/ that. Alos there was some mention of a Birthday deal & I could NOT get information on that. So, I lose on: using my points & I lose on any B-day deal. I did speak w/ someone @ Pizza complaint line BUT they too were on NO help!!!!|Useful|Share",16-Feb-23
Cathy Peeples,The worst service ever. Was on hold for at least 20min to place order to find out I have to use online ordering just to not be able to redeem my points. Why give the points and they caibe used.|Useful|Share,16-Feb-23
Luca Salis,"first time i tried the pizza in this chain ,but was not bad at all , next time please put more mushroom|Useful|Share",13-Feb-23
Sharon R. Pottebaum,"The first thing was that we were told there was no ice available.  There was 12 in our party and we ordered several pizzas, wings, fries, pizza melts and bread sticks, soda, tea and water. It was 5:00 on Sunday evening and there’s several convenience stores in the close proximity.  When we asked about salad we were told No Salad.  When we ask for salt and pepper we again were told  NO salt and pepper !!!! The ladies bathroom was nasty.  The floor had not been cleaned in quite a while.  It was actually sticky 🤢. The sink and toilet hadn’t been properly cleaned lately either. Needless to say NONE of us will be going back to the Pizza Hut in Warrenton, Mo.|Useful|Share",11-Feb-23
Bruce,"No cash, no table service, order on a website!  If this is the future of eating out, it’s effin’ cancer.  The food was mediocre at best.  Just don’t bother|Useful|Share",11-Feb-23
Leighton Walmsley,Great food with the family|Useful|Share,10-Feb-23
Shaz,Very bad customer service given by a manager|Useful|Share,9-Feb-23
Mr Dass,Amazing pizza. Kids were happy !|Useful|Share,8-Feb-23
James Nicholson,"I was a regular visitor to my local Pizza Hut Restaurant, at least twice a month, and could never fault the food or service.Decided to go there this week for Valentines Day, and it was disappointing. The service was fine as usual. The issue was the aircon being on across the building, which meant that our food was merely warm as we were eating. If I’m spending close to £50 on a pizza & sides, I’d expect it to stay reasonably hot whilst eating.|Useful|Share",7-Feb-23
GachaLife FanGirl_Lunah,Devon Taylor great costumer service hope to see you again|Useful|Share,6-Feb-23
LAURA LEE JONES,Did order online for pizza hut in Angel Edmonton. Kerryn was my customer service rep.I've never had such mannerable service from a customer service rep.Let Kerryn teach new workers how to address and deal with the public. KERRYN YOU'RE A STAR 🌟|Useful|Share,5-Feb-23
Jac,Love this placeExcellent staff and productsService always great Clare is brill and rest of team tooThanks so so soRegulars|Useful|Share,5-Feb-23
Darren,"I ordered online from your Benfleet branch, to be delivered.  I then received a call stating they have no drivers and don't know when they will have one as they now have to rely on delivroo and in her words she said they are rubbish.  I then asked to cancel my order and issue a refund, she stated to do this I would need to e mail customer relations as they need to authorise a refund. I went ahead and e mailed them to get a e mail stating it will take up to 3 days for a reply due to them being busy, so I'm looking at well over a week for a refund. I have never known such a ridiculous process! Maybe next time don't take orders you can deliver!|Useful1|Share",5-Feb-23
matthew peterson,I was a driver for pizzahut but they done away with in store drivers so that doordash could take all the orders not cool to who ever make the change..........|Useful|Share,5-Feb-23
MS SCHMIN NEWSTUBE,"I was ordering from East ham branch. The man that took my  call was so rude. My order was over £25. So they should have given a free item.I am disabled and have ordered a lot, nearly once a week, but the guy who answered at 415pm was very rude and twice before they made a mistake.  The branch manager at that time was extremely rude, ( they sent a pepperoni pizza to a vegetarian a couple of weeks ago) like the guy today , it seems that they are happy to take the money but never happy to to be courteous to customers who's money they depend on. NEVER AGAIN. I FEEL THAT TH3Y ARE THIEVES! BE VERY CAREFUL IF YOU ORDERING FROM EAST HAM BRANCH. SHOULD HAVE STOPPED BEFORE, RATHER THAN ALLOWING THIS TO HAPPEN|Useful|Share",4-Feb-23
Natalie Mann,Don’t order online they are rubbish I will never entertain them again always use domino’s or fat Toni’s left it untilThe last min to tell me they have no drivers and now have to wait a week to get a refund can’t understand a word they say on the phone never again order no 6872696316|Useful|Share,4-Feb-23
MrsMG,"Went to Pizza Hut @ Merton Abbey MillWatermill Way, London SW19 2RDAll the Staffs was Brilliant 🤩 customer service was on point from start to finish. Restaurant was very clean. The salad area was always well taken care of was cleaned, full staff made sure the salads 🥗 was fresh. Our foods came all together, and it was delicious. Restaurant is family friendly. Definitely will be coming back again highly recommended.|Useful|Share",2-Feb-23
customer,"My husband and I were craving Pizza Hut pizza so we drove to Pizza Hut, went inside, but the place was empty. I mean no workers, nothing! There was a jacket in a booth and the lights were on but there was not one single person in site. There were cars parked outside but we were perplexed. We stood at the counter for a moment as we wanted to order in. Nothing. My husband called the location hoping someone would come to the front and see us but the phone rang and rang without any answer. We stood for a moment longer discussing where else we should go and eat, hoping someone would seat us and acknowledge we were there but nothing. It was really odd. I’m not sure where the workers or the manager even was. We left and will not be returning back to Pizza Hut. It was a sad disappointment as I remember eating at Pizza Hut as a child and we had so much fun and great family memories.|Useful1|Share",1-Feb-23
tyrone,"WAS UNREAL, GENUINLEY|Useful|Share",1-Feb-23
Kate Patrick,"Our order took 1hr 25 mins to arrive, the order was wrong and cold. Tried calling Gloucester hut, it took 10 phone calls to actually have them pick up the phone. When I complained to customer service and asked for a refund, they refused despite the terrible service. We will never order from them again.|Useful|Share",31-Jan-23
Craig Herring,"Cannot believe that in times of high inflation and with some people struggling to have spare cash to treat themselves to treats like Pizza Hut, this restaurant chain takes the decision to increase its value range (Hut Saver Menu) to £8.99 per pizza. Last year the pizzas on the value range were only £5 per pizza. That’s an increase of 80%, plus they also now charge £1.50 for delivery which never used to exist.Shame on you Pizza Hut for ripping people off when they are hard up for cash. These price increases do not fall in line with the current rate of inflation which means that you are just looking to make maximum profit at every opportunity you have.Last year I used to be able to buy 3 pizzas in the Hut Saver Menu for £5 each totalling £15. Now you want £8.99 per pizza totalling £26.97 plus £1.50 delivery which now totals £28.47 and that is a 90% price increase.A 90% PRICE INCREASE IS AN ABSOLUTE JOKE. PURE GREED AT ITS BEST AND I’M PERSONALLY NOW GOING SOMEWHERE ELSE.|Useful|Share",31-Jan-23
Gail Wilkie,"The most discusting pizza iv ever tasted . Where the hell is the cheese ? I couldn't even eat it , ill never go again ever|Useful1|Share",29-Jan-23
Ant. H,This formal complaint against the above company restaurant and extremely poor service and support and help also long wait times for the food I ordered and very poor help and support from manager called Dan also . Went the above restaurant tonight with my boyfriend to get an table for till on arrival seen this male called Dan who an manager told me to come back in approx 30 mins  also asked if I can booked an table online he said yes !When back just after 20.00 pm to get a table for two the same person in question said give us a couple of mins while it get cleaned of course I said thanks u . I didn’t expect next what happened next So got to seats and then looked at menus I ordered using the app and placed an order for 3 sides and two drinks and one large pizza witch totally £47.16 over all . At this order went in approx 5 mins later on I went up and spoken to male again who called Dan asked for glass who replied rather than say here u go you’re have to wait until they came to the table !! I found his attitude extremely poor and shocking in how he came across to me and didn’t mean an reference back to him They then came to table no thanks from server from this point until I asked a member of staff when they were serving an larvae party who came in no one came to table or explained there’s long delays etc with food . When I stopped a member of staff I asked her how long food will be what we ordered and the email address from Pizza Hut has the service was outrageous and poor . Even when I asked where the food the person came back still being made I asked the same member of staff again for Pizza Hut email address and at this point then manager came over he’s called Dan restaurant manager also !!!His attitude the experience didn’t help I asked email for emails rather than get it me he told me to Google it and didn’t want to find it until I said I email the ceo for Pizza Hut !! I explained the service was extremely poor and experience too he didn’t seem to care when I said I would email customer care he just simple no problems or that’s fine I asked him for area manager information he wouldn’t provide this to me but then said before I decided to walk out and cancel my order because his experience and outrageous help and service I will inform area manager and customer care of which I found worrying in fact I would say he’s already trying to cover his own back Has my food was about to come to table I got up with my boyfriend and cancel my order I told this manager called Dan the reason for leaving his you the way he treated me and helped and acted outrageous and shocking I would question if he seems to have problems me with my boyfriend too ?I am extremely shocked and upset and this made me walk out also my partner need food because of his health and couldn’t wait any longer.I am visiting up here and live in Manchester and I have never experienced such extreme poor and shocking behaviour which made me walk out in this way !!!!!!!Someone needs to contract me urgently about this I ended up having to go kfc instead of what I didn’t want too|Useful|Share,27-Jan-23
Travis,"Tried calling the store 9 times as I made an error, they don’t answer or respond! On top of that the pizzas have next to no toppings !! DO NOT ORDER FROM HERE!! How they are allowed a Pizza Hut Franchise is beyond me, I will be contacting head office for a refund as the store does not respond!!! This place is damaging the Pizza Hut Brand, seriously consider removing the franchise from this owner|Useful1|Share",27-Jan-23
Melanie Harper,Two hour wait again  this had happened about a month and a half ago. They had door dash deliver without even letting us know. They left the pizza outside on the front steps. Decided to try again because they use to have good service but once again another fail. No more Pizza Hut here. Marcos is 10 times the value and very friendly customer service.  Just wish they had wings|Useful1|Share,27-Jan-23
Adam Hextall,Fantastic service again and again by the manager Yasir at PizzaHut Hoddesdon. A really nice chap and so much more friendly than the previous manager. Very helpful and super quick piping hot pizza today. Highly recommend the new management and big thanks.|Useful1|Share,26-Jan-23
Laura Court,Talk to customers and treat them like we are fools.|Useful|Share,25-Jan-23
Virginia Smith,"This post is unusual for me. I always make an effort to find something positive to say about a business, regardless of any issues. This Pizza Hut, in Ellisville, Mississippi will be the exception.  I wish I could give a -3 rating. On 1/31/2023, I decided to pick up a personal pan pizza near my home after driving 8 hours from Atlanta. I stopped in Laurel around 6:15 PM and called the order in. I arrived at the restaurant by about 6:30 PM. I waited about 10 minutes to get to the window to pay. I paid cash. I was told to pull forward and they would bring the pizza to me. I waited and waited, until about 7:10 PM. I went into the store to find out what the problem was. I approached the counter. I tried to get the attention of an older woman who seemed to be the one in charge. She asked me what I needed, and I told her in a normal voice that I had been waiting for a long time for my pizza. She said she did not hear me, so I repeated my issue again in a normal voice. She again said she could not hear me. So, I raised my voice. She then told me that I did not need to yell and that I needed to be respectful. She did not indicate to me that she was going to give me her full attention, and proceeded to continue arguing with me that I was being disrespectful. Now I'm mad. One of the workers came around the corner with my pizza. I was told it was her first day. Fine. I asked if I could get a refund. The older lady said no - that she would give me a credit. This lady continued arguing with me and never indicated to me that she was going to make the situation right. A man at the counter tried to give me $7, as if the money was the problem. I told him I did not need or want his money, that I wanted them to take responsibility for keeping me waiting for so long. The lady still did not stop what she was doing to try to issue a refund. So, I just left. With this business, when they mess up and should make it right, they antagonize and argue endlessly and when the customer gets angry, they blame the customer for getting mad and do nothing to make the situation right. I will never go back to this business. There is nothing that they can do now to assure me that they will not antagonize me, then make me look like the Karen when they are the ones that messed up and would not do anything to make the situation right.|Useful|Share",22-Jan-23
Beth F,Thought I would try Pizza Hut and the New Yorker and some wonderful Cinnabums..worst food ever! Buns didn't rise flat as the road they tasted like and the pizza looked 4 hours old! If you want good food..don't go to pizza hut!|Useful|Share,22-Jan-23
Damarion Dorsey,Great food but could improve employee kindness.|Useful|Share,22-Jan-23
david huggins,All cheese no pepperoni or sauce.Doubt I would ord3r from them again|Useful|Share,22-Jan-23
Victoria Sullivan,Been waiting for 1hr 40mins for our dinner now. Called the hut 3 times keep being told it will be there soon. Aweful service. Last time I'm ordering for pizza hut|Useful|Share,Updated 22 Jan 2023
Coryn Shields,"Awful service, my Pasta was cold, I went to the counter to tell somebody and he said ""I don't speak English"" and walked off 😳 Then a woman came out and asked what was wrong, so I told her that my Pasta was cold and she told me that I should have eaten it as soon as it came out 😡 I told that I tried but that it was cold, she shrugged her shoulders and offered to warm it up in the microwave for me, which I had to accept as I didn't want cold Pasta! The staff were disinterested and rude, much different from the staff at the other restaurants that we have eaten at so far who have been lovely. So glad we didn't come here first!|Useful|Share",18-Jan-23
Boycott Regus IWG,best fast food restaurant out there. its cheap delicious etc|Useful|Share,17-Jan-23
jonno manton,this companys advertisement does not reprosent a true example of the menu! avoid.|Useful|Share,16-Jan-23
Jason Read,Advertising buy one get one free. It's not buy one get one free at all! It's an out and out lie! How on earth this company get away woth this. Untrustworthy and lacking any honesty or integrity! Never use them if possibly! Better value for money else where and without the need to mislead customers!|Useful|Share,16-Jan-23
john bentall,Took my money and cancelled my order now I have to wait 3 days for money back and now don't have money to feed my family thanks sandwiches taste so nice after promises of pizza|Useful1|Share,14-Jan-23
Dawn  Chadwick,My Granddaughter had a birthday party today at Pizza Hut Xscape Castleford. They had a good time but I want to praise our server Chloe. She’s an asset to the company|Useful|Share,14-Jan-23
Liz,"Ordered a pizza and sides, went to collect them got them home within 5 minutes and the pizza and sides are not hot at all, pizza looks like its been out for a while really hard and crunchy like they had it on the buffet that day and instead of chucking it away they have given it to us and wasnt freshly cooked to order, I am disappointed, dominos at least serve you fresh pizzas. Going to go there in future as for what i have paid, isnt worth the money.|Useful|Share",12-Jan-23
